Religious Affliation,South Asian Heritage,Cause of Mental Health problems,Treatability,Treatments,Experience or Wittnessed stigma,Incident Description,longitude,latitude
Islam,Maldives,Lifestyle and genetics.,No,They can be brought under control but not cured.,Experienced,Was told to go off antidepressants because depression is “not real”,72.56265914154422,4.932195934680659
,Maldives,Genetics and mentality,No,,Experienced,Annoying in time,73.11697539771396,-0.308401258
Hindhu,India,Genetics,No,It's something you are born with,Experienced,,68.45753960488635,29.257033515507686
Islam,Maldives,"Genetics, environment and trauma",Yes,"With medication, therapy and a lot of will power",Experienced,Yes,73.48146370364077,-0.462930324
Islam,Maldives,Stress and uncertainty,Yes,Psychoherapy and psychopharmaceuticals,Experienced,When saying I am going to consult a Psychologist I was asked whether i am psycho.,73.37269614002999,6.891997873729062
Islam,Maldives,"Stress, relationships (friends, family), upbringing etc",Yes,Through therapy and recovery as per how comfortable the patient is,Experienced,Was told that depression is just something they say to get out of fulfilling responsibilities,73.15918597698551,1.4877586903628353
Islam,Maldives,"Lack of awareness, education and due to both biological and environmental factors",Yes,Mental heal can be treated by self care and proffesioneler help,Experienced,Was labelled as a person with lack or eman and crazy,73.36806007665017,2.2867068031394946
Islam,Maldives,Life?,Yes,"Takes time, patience and help",Experienced,Was going through a panic attack and had to stay with her till it resided,73.03362428823563,0.6038718876143482
Islam,Maldives,Environment,Yes,Medication/ psychotherapy/ CBT,Experienced,Underestimating ability of a person with mental health issues,72.7921254,1.1828504008541354
Islam,Maldives,"Stress , tension",Yes,"By meditating, medication",Experienced,Stress and anxiety,72.60288447802878,2.9356688154222432
Islam,Maldives,"Socio-economic problems,",Yes,With right techniques over time,Experienced,Some people considering mental health problems are due to lack of faith,72.78729924186013,7.024010059606256
Islam,Maldives,Biological social and environmental factors,Yes,Yes there can be treatments to manage the illness,Experienced,Seen many people hide their symptoms and not share their experiences because of what others may think,73.70385075399298,-0.641310016
Islam,Maldives,Moslty due to self esteem and societal views,Yes,By getting professional help,Experienced,Seeing people blame the person’s religiosity,72.833335,3.8877619545777837
Islam,Maldives,Stress and Trauma,Yes,Therapy and Medication,Experienced,People think they can’t be relied upon,72.88421609753276,5.4512613164375745
Islam,Maldives,"Can be anything. Trauma, family problems, stress, etc…",Yes,,Experienced,People think having a mental condition means that the person is crazy or something.,72.78905824515881,5.7934916045215346
Islam,Maldives,Genetics + experiences,Yes,,Experienced,People not believing in the condition itself & asking to be more religious for you to be okay,73.54900988367328,0.20555707130256373
Islam,Maldives,trauma,Yes,through both therapy and medication. strong support group,Experienced,people making fun of my suicide attempt,73.63771603617553,0.7686158807235225
Islam,Maldives,Trauma,Yes,Medication and therapy and help from loved ones,Experienced,"People look down on you, assume you can’t fully achieve much, assume you’re crazy.",72.89097703882209,1.2765752003604636
Islam,Maldives,stressful life evens,Yes,"they are many ways nowaday mental health can be treated. by therapies, medications",Experienced,"one of close friend.. we think she needs help.. she said she doesn't need help and it's effecting so much on her health, work and personal life",72.73869725738011,-0.379427003
Islam,Maldives,stress and relationship issues,Yes,therapies and medication,Experienced,one of close friend. she need help badly but she is scared to go for therapy because of what peoole will say,73.22509845480494,-0.216130127
Islam,Maldives,Society,Yes,Support and assistance,Experienced,,73.33588890095174,0.2277072505042923
Islam,Maldives,Trauma,Yes,therapy,Experienced,,73.18752224983899,4.889684088193238
Islam,Maldives,Loss of loved ones,Yes,With help,Experienced,,72.51725298622468,4.259317822305299
Islam,Maldives,Stress,Yes,Proper counselling,Experienced,,72.83140893350654,4.107042052373631
Agnostic,Maldives,generational trauma and childhood trauma,Yes,you can learn how to cope and how to live with them.,Experienced,my mental illness went ignored during childhood because i was assumed to be dramatic - even when there were sudden changes in behaviour and clear signs. when i first asked for help i was told to try harder.,73.36702133194684,5.999948791001678
Islam,Maldives,Stress and difficult living situation,Yes,With medications and councelig,Experienced,"Moya naasira story, I hope you will know that story",73.42824222858324,6.614464962075955
Agnostic,Maldives,"stress, childhood trauma, other traumatic and abusive experiences",Yes,,Experienced,mental illnesses are considered as an excuse or not real,73.32067092255681,2.2664750492870485
Islam,Maldives,Less faith and lack of love,Yes,Have more faith in the creator and witty love and care,Experienced,Losing temper and getting hysterical,73.41763124,0.7783436274481804
Islam,Maldives,being alone,Yes,through therapy,Experienced,leaving them out,72.84806105925131,-0.567021701
Islam,Maldives,"Childhood trauma related to bullying, comparison with other kids around you by your family or teachers, abuse, troubled family, constant bickering around you, isolation, etc,.",Yes,"Consult a professional, be around people who understands you and supports your wellbeing.",Experienced,It’s hard to explain. So many of my own mental health conditions are challenging. It’s not easy. Especially when you don’t have people around you who gives full consideration into your comfort zones.,73.60594883243286,3.936589977385625
Islam,Maldives,"Childhood trauma, family trauma, stress",Yes,"Loved once or professional help, self",Experienced,It's usually of arrogance. Not understanding,73.26549674706577,6.611849352241263
Islam,Maldives,A lot of things.,Yes,,Experienced,I was told that Depression is not real.,72.66847399852163,4.993010804768082
Islam,Maldives,"Social and financial circumstances, biological factors, and lifestyle choices",Yes,With proper treatments they can also lead a better life,Experienced,"I started having ptsd after the loss of my baby, people tend to left me out, got no one to talk to and fails understand how badly you might need help",72.97368903530926,1.7795913543682462
Islam,Maldives,Environment and genetics,Yes,With professional help it can be treated but some disorders cannot be treated but symptoms can be managed,Experienced,I have been told that I am overreacting and pretending for attention,72.99815172266788,0.8815132600246564
Islam,Maldives,Stess / childhood trauma,Yes,By therapy. Medication. Understanding people around you,Experienced,Got told by some of the family members that im constantly acting being in fear and being diagnosed with this is not a valid reason it doesn’t exist. And if even if its true it’s because im not a good person,73.03435702420556,0.6855875829101216
Agnostic,Maldives,"Very multifactorial, based on both nature and environmental conditions",Yes,Behavioural therapy or/and medications.,Experienced,"Generally being referred to as ""crazy people""",72.60314172760083,3.204419744
Islam,Maldives,Stress and way of life,Yes,"With proper treatment and support from everyone, it can be treated",Experienced,"Feels left out, no one knows what to say or do be supportive everyone is busy with there own lives, healthcare system is too expensive to afford and at times the people to aware you don't give you supportive statements as well..",73.64754092610238,0.8942253097778067
Islam,Maldives,Unable to deal with trauma and handle emotions,Yes,Therapy,Experienced,Family elders think that mental health conditions are not real and that they are caused by lack of faith. That i just need to pray to get better.,72.56540995654126,-0.226807783
Islam,Maldives,Nature and nurture,Yes,"With proper therapy, medication (if necessary) and with a good support system",Experienced,"Called being lazy all the time, called crazy, called that overthinking and to snap out of it",73.60791997645052,4.695416524314503
Islam,Maldives,Poor past and traumatic experiences,Yes,"Yes, have been seeing improvements myself after taking EMDR therapy",Experienced,Called as a person with low faith. Just pray and do Hijama and it will be treated. Therapy is useless,73.66253761185021,-0.283634053
Islam,Maldives,"genetics, living conditions, situations faced by individuals in life",Yes,"through guided therapy, medication and a lot of willpower and willingness to be better from the individual in question",Experienced,being shamed for lack of hygiene and inability to meet deadlines which was a result of depression. being labeled as lazy for sleeping all the time.,73.30288908206457,3.3182732525810112
Islam,Maldives,"Genetics, Trauma",Yes,Appropriate behavioural therapy,Experienced,Accused of seeking attention / exaggeration,73.34769434922235,1.5509148728713553
Islam,Maldives,A combination you of nature and nurtue,Yes,Medication and therapy,Experienced,"A number of close friends being told to pray more when they’re extremely suicidal and depressed, family asking to keep their scars and stories hidden",72.73398085204015,0.015508061803153117
Islam,Maldives,"Traumatic experiences, Family problems and other social issues.",Yes,By therapy and support from family and friends or close people.,Experienced,"A friend who is suicidal, doesn't get much help from family or therapy or he just don't want to get better.",72.52340156654398,0.6157462479437924
Hindhu,India,"family, environment, genetic traits",Yes,"Counselling, drug treatment, change in environment and change in behavior",Experienced,"I have seen children and elderly people suffering from mental health in the society, who are tortured by the family and society. Seeing their behavior, instead of understanding them, people tease and beat them.",87.82990913247824,34.30632531133611
Hindhu,India,"Family history, stress, addictions, genetics, environmental causes",Yes,"Some can be treated and some can be managed with medication, therapy, in patient care, family and friends' support",Experienced,"Yes. I have seen many people who think that mental health problems is an act or a a stunt for sympathy. It's nothing. Just get up and go to work, you'll be fine. Or people just call you crazy.",73.84089353897767,12.003333418880974
Hindhu,India,The upbringing of a Child does have an impact on their personalities plus some hereditary conditions.,Yes,Through therapy and ofcourse medications,Experienced,YES In my family my father had a stigma of not visiting Psychiatrist as its just on what we think if we change our thinking patterns we will get healed ourselves.,94.89885286855002,22.183740291875345
Hindhu,India,Stress,Yes,By taking professoional guidance.,Experienced,Yeah I have the person was suffering from depression . He got an anxiety attack.,93.33415284571893,36.41461116758938
Hindhu,India,Stress regarding anything that is causing disturbances in lifestyle.,Yes,Cope mechanisms are taught which can help the person focus onto positive thing and achieve potential.,Experienced,"Yea , I was when my friend said I'm feeling low my other friends said instead she drama kid.",74.93949225255994,22.818494339089185
Hindhu,India,"Society, family pressure, peers",Yes,By taking therapy and self motivation,Experienced,When I was 14 years old I saw a boy getting bullied due to his hyperactive behavior and people would take advantage of him,82.75616108516391,21.085615773148298
Hindhu,India,Family issues,Yes,Visiting a psychologist or talking to your loved ones or engaging yourself in some activity that interest you.,Experienced,They mentioned you don’t have to visit a psychologist for this,86.62841167875214,21.253434618590756
Hindhu,India,"Genetics to some extent (my mother had undiagnosed bipolar disorder); cultural stigma and denial (even though my father was a psychiatrist); toxic environment: lot of pressure that exacerbated stress, anxiety, burnout, and substance abuse",Yes,"I shy away from the word ""treat;"" I instead say ""manage,"" and it's done by a combination of meditation, cognitive behavioral therapy (CBT), healthy relationships, nutrition, exercise, meditation, mindfulness, and breathwork",Experienced,"There was huge stigma: my father refused to admit that there was mental illness in my family, even though it was ""hiding in plain sight:"" job instability, unstable relationships, lack of sleep, irritability, fluctuation from grandiose highs to dark lows, etc. He didn't want to acknowledge that I had Bipolar disorder. Also, my wife (who eventually became my number one supporter) initially refused to accept any idea that I had bipolar disorder, thinking that I just needed to ""think more positively."" This prevented me from getting diagnosis and seeking treatment.",84.11323326729112,14.253614904400422
Hindhu,India,"various stimuli like family, societal pressure",Yes,medications and therapies,Experienced,people with Cerebral Palsy or even schizophrenia are labeled as being mad.,84.36879350193391,11.414536504505769
Islam,India,"There are many reasons, but to broaden it, i believe the interplay of nature vs nurture",Yes,If the individual is willing to get treated by the right mental health expert and has the available resources,Experienced,People saying that the new generation is making up issues over small small things and then calling it anxiety and depression,87.63105923280699,27.44576200745304
Hindhu,India,"Genetic, environmental, social",Yes,Consulting with therapist/psychologist,Experienced,Parents believing that mental health conditions in children is just a 'phase',78.31067353847381,11.197413128714556
Jain,India,"Most likely environmental factors, My family has a history of depression as well, so I would say genetic factors as well.",Yes,"I have been receiving treatment for my depression through medicine and CBT, it has worked well for me so far.",Experienced,"Often some of my family members would call me lazy, or would say I am ""Just sad""",86.93877275664923,11.635608018440305
,India,"Parental trauma, societal pressure",Yes,,Experienced,,83.2636264,13.039239316050086
Hindhu,India,Bio-psycho-socio and environmental factors,Yes,,Experienced,,90.93166628897322,18.55282303150645
Hindhu,India,"Triggers, chemicals in the brain, genes, trauma",Yes,Professional help.,Experienced,,95.68159624,23.630195875905628
Hindhu,India,By birth and sometimes stress,Yes,,Experienced,,68.65377465401977,32.33964501043939
Hindhu,India,environmental conditions,Yes,,Experienced,,87.14114244233167,32.93555925843743
Hindhu,India,none,Yes,therapy,Experienced,mental health to be neglected,74.63003540881924,26.86494494998174
Islam,India,Life,Yes,Not sure. Trialing anything and everything,Experienced,Medicine will make the depression worse. People believe self help is the best way and medication should be avoided.,71.31116562699037,7.336552415411813
Hindhu,India,Genetics and nurturing depending on person,Yes,"Holistic and western remedies depending on what works pee individual based on their severity, accessibility, etc",Experienced,"In addition to anxiety I am on the autistic spectrum just like my brother. He was diagnosed quick due to language issues yet I got no diagnosis until I sought help as adult despite my many academic and social emotional learning challenges. I think this had a lot to do with gender and model minority myth. My parents had advanced degrees and saw me as a kid smart enough to do anything but too lazy, and to this day I'm seen as not trying hard enough.",80.61560898053696,12.867412852735923
Christian,India,"Various factors including cognitive, psychosocial and biological causes",Yes,"The etiology can be understood and measures can be taken to provide the proper treatment, whether through therapy, various interventions or medication depending on the severity of the condition.",Experienced,"I would get panic attacks and people said I was just faking it for attention, or that I just needed to calm down and breathe.",69.52493253,31.891777165896308
Hindhu,India,My thinking patterns,Yes,With the help of professionals and one's own will one can achieve the results one is expecting from therapy.,Experienced,I myself did experience a situation where i was made to feel bad  about my psychological well-being.,95.68115613942058,23.878587049139334
Hindhu,India,"Severe stress of academics and my family, also it's genetical",Yes,With proper therapy and psychiatric medicines if needed,Experienced,I have experienced stigma in my family itself as they used to believe there is no need to seek help for metal disorders and that made my depression worse,75.00578912650761,12.128187529832655
Hindhu,India,Family,Yes,By seeking therapy,Experienced,I have experienced social stigma of what people will think regarding my mental health problems,86.65241955363892,33.807973054472775
Hindhu,India,stress. Society and the way they think on people. Anxiety,Yes,By talking about issues to a professional,Experienced,I have epilepsy and was Almost suicidal as I don’t drive and when I talk about it to people it helps. I know that others in my same diagnosis feel the same so it’s good to talk about it or find a hobby to keep me busy so I don’t think I have it,92.09110152687032,28.777995485556723
Atheist,India,An individual’s innate nature and their environment can both be contributing causes,Yes,People will get better if they receive help but some may never be cured completely.,Experienced,I have anxiety issues and suffer from attacks frequently. Many people have asked me to get over it or to stop overthinking.,91.51314623971251,26.48419305015988
,India,Genetics and day to day life stress maybe,Yes,Therapy interventions,Experienced,I had to tell my family that m taking a study classes when I started therapy,70.20272896701792,32.23286006144965
,India,Genitics or day to day life stress,Yes,Therapy interventions,Experienced,I had to tell my family that m taking a study classes when I started therapy,82.13551885961158,10.785231460323395
Hindhu,India,Negative thoughts,Yes,,Experienced,Fear of loosing loved ones,69.01182915302724,12.424402144997682
Hindhu,India,"childhood trauma, defective parental upbringing, societal beliefs",Yes,coping strategies,Experienced,due to my social anxiety i have heard many times that I wouldn't be able to have a proper career or would end up doing nothing,87.26132067496684,24.45881436523281
Agnostic,India,"Immediate Environment, Genetics, Trauma",Yes,"In the short term, steering away from drastic events such as suicide/self harm and treat long term mental illness with coping tools and most importantly a support system that can assure longevity of successful treatment.",Experienced,"Both experienced stigma against my struggles and witnessed the same with others, mostly alienation from close friends presumably due to lack of information regarding the matters, exhaustion or irritability from engaging in others crisis situations and fear associated with the stigmatised and dramatic representation of mental health conditions.",76.55485297927206,23.78090817633715
Hindhu,India,"Depends on the treatment recieved by the individual from people around them, environment and family and genes",Yes,With professional help and support and a supportive environment,Experienced,"Been told it’s a phase and would pass on, called selfish and attention seeking",83.40200284,31.94847153754494
Hindhu,India,Various Stressful stimuli like family,Yes,Medication and therapy,Experienced,A person with schizophrenia or even cerebral palsy is labelled as being mad in the community.,77.29243992559364,21.453680463214077
Hindhu,India,childhood trauma,Yes,therapy,Experienced,a friend with bpd always feeling left out,84.31856046,29.172954268189734
Islam,India,"Genetics, trauma, environmental factors.",Yes,"With proper diagnosis, medications, and support system that encourages a healthy lifestyle, yes, many mental health issues can be treated.",Experienced,"A family friend of mine was diagnosed with a severe mental disorder, schizophrenia and BPD. But they were afraid to reach out to their own family members and friends because they grew up in an environment where a person with any emotional disturbance or mental issues were labelled as crazy and we're outcasted. This person stay in denial about their illness through their whole life living in that fear.",83.66970464781711,36.09017446823359
Islam,Pakistan,"Childhood traumas, bad experiences with your loved ones, insecurities",Yes,They can be treated but it takes alot of time to heal,Experienced,"Yes, when i was having bad mental health everyone said you're over sensitive. People easily said that you're attention seeker",64.30853004126544,33.10070327866458
Islam,Pakistan,"Extreme Pressure of society, Relationship without marriage, pressure from university or home, Lack of Consultation, Anxiety etc",Yes,"Yes, by diagnosing and treating properly can treat mental health conditions.",Experienced,"Yes, in my hostel my room mate suffered from mental health issues due to extreme depression. She used to take sleeping pills. Then we got her treated from psychiatrist.",75.98433430747308,27.725726314744364
Islam,Pakistan,"Mental health is very important for everyone their several causes of mental health conditions like family disturbance, environment factors, genetic factors and individual personal disturbance from their life.",Yes,By contacting best psychologist and psychiatrist and take regular sessions and therapies or medicine cure this condition.,Experienced,Yes In my internship I see lot of people's suffering form different mental disorders. Some have depression and show no interest in every activity and always in his depressed mood.,72.37447439,29.995901534799085
Islam,Pakistan,,Yes,Because of different issues in life may be financially or practically or Any other reason,Experienced,Through a depression because of some issues,70.20441119405228,29.852846804424853
Islam,Pakistan,Can be genetic issues or environmental causes,Yes,Because there are some therapies and treatment out there to trear.,Experienced,They thought that it is because of evil eye,70.98258827359997,26.420650219356716
Islam,Pakistan,Yes because it is very important to live in healthy environment,Yes,To spend healthy life,Experienced,The experience wasn't good,68.42018579872064,34.00086598988926
Islam,Pakistan,"Could be anything, past traumas or could be genetically inherited",Yes,Very hard but yes if the person is strong enough  to fight back and to accept their mental health struggle and shows his/her commitment to themselves that they will overcome their condition.,Experienced,Sometimes mental health issue become part of their personality and they unwillingly hurt other people by words or their attitude.,71.76931958893846,26.224719802784495
Islam,Pakistan,"traumatic experiences ie abusive relationship, childhood experiences, death of loved ones, sexual assault etc.",Yes,"with familial and community support, therapy and medication",Experienced,"people with asd are considered ""lesser"" than neurotypical folks. they r looked down upon and discriminated against",71.05692011504382,26.93636638498133
Atheist,Pakistan,"a mix of genetics, environment, and trauma",Yes,It can't be cured but it can be managed with medication and talk therapy,Experienced,People treated me like I was less intelligent and less capable,62.08449518521079,30.157950425379532
Islam,Pakistan,Depression,Yes,,Experienced,,71.72443218673818,35.91454592353473
Islam,Pakistan,Genetics Enviormnetal SES,Yes,,Experienced,,64.18830156505155,34.94717126076172
Islam,Pakistan,Over thinking,Yes,,Experienced,,66.00144933910308,31.452074938325126
Islam,Pakistan,Arguments between our parents,Yes,By visiting doctor,Experienced,,74.22249282049526,35.74955141365827
Islam,Pakistan,Family and friends environement.,Yes,,Experienced,,69.01862276477694,27.07440831288824
Islam,Pakistan,People,Yes,,Experienced,,70.87463570257663,28.548899257747447
Islam,Pakistan,"Mental health conditions are such as anxiety , depression",Yes,"Go to phycologists and to change environment, also relax mental health",Experienced,my aunts have a issue about mental health,75.39846618361442,24.366256808288718
Islam,Pakistan,Family problems,Yes,Through therapy,Experienced,It happens many times,67.47640692118908,26.209417147508525
Islam,Pakistan,Causes are different social economical personal,Yes,By getting professional help,Experienced,I'm a psychology student I have witnessed and experienced many incidents,65.87886045618642,24.69241674270134
Islam,Pakistan,My family issues,Yes,Mental illness is not a thing that can’t be cured in today there are therapists that can make you feel better,Experienced,I was in examination hall everyone is calmly doing their paper and suddenly I got panic attack and started crying that was embarrassing even teachers told me you should be strong others saying she’s faking it for attention it was a disgrace,66.0681831,31.307584638802446
