Islam,Pakistan,Unsupported environment at home,Yes,By talking and letting others know what you are going through (therapy),Experienced,"I have struggled a lot with existential anxiety and depression, I was constantly told that this is nothing and that I am just letting shaitan win if I carry out like this. A few of my friends were and my mosque teacher were super kind and supporting . They  help me to  see a clearer view of what's happening and they  listened to me without invalidating my feelings. It was horrible having to deal with it alone. It would have been way better if I could reach out to a professional the process of recovery would have been much faster and efficient. Nevertheless I am happy now and that anxiety has not comes back yet.",73.61775511346092,28.46595212042742
Islam,Pakistan,Mostly the stress from the family problems. About the father's lack of love. Your mother not being as affectionate as they need to be. Financial instability. Etc,Yes,Through talking to a professional and taking medication if needed.,Experienced,Every one calling me oversensitive and laughing at me while I was screaming my lungs out and crying.,64.41662378084662,25.617496547503467
Islam,Pakistan,"Mental health conditions can stem from a complex interplay of genetic, biological, environmental and psychological factors.",Yes,"through a combination of therapy, medication, and support systems tailored to individual needs.",Experienced,"being unfairly judged, avoided, or marginalized, perpetuating misconceptions about their capabilities or character.",75.24642463834799,32.31918213830015
Islam,Pakistan,Societal insecurities,Yes,By communicating issues with professionals and letting the thing out and seeking treatment regarding the issue,Experienced,A person who hated himself thinking that he should end his life because he just isn't good enough because of his past experiences and excessive use of drugs,62.60419252348293,32.46401963095526
Islam,Pakistan,Some kind of traumatic events,Yes,"Mental health conditions can be treated by family support, psychotherapies and with counselling as well.",Experienced,A person lived in our town head OCD but people of my town said that he is crazy man. His family members also consider him crazy and this word  is the stigma of for him,71.06920744,26.76212248003504
,Nepal,Stress,Yes,With proper communication,Experienced,People try to maintain distance from those known to have undergone mental health disorder.,87.90163671,29.507393137095693
Hindhu,Nepal,Multi- factor can cause mental health conditions simply from childhood rearing experiences to daily life shortcomings. Most of them arise out of inability to adjust to living condition's and accept as oneself..,Yes,"with therapies, medication, healthy life practices",Experienced,most people believe it occur due to sin,87.55521890244066,27.338473998397074
Islam,Bangladesh,Environmental factors/surroundings and triggers as well as biological,Yes,Through therapy and medication.,Experienced,"Yes, telling a family member how I feel and them not taking it seriously.",89.88789974773658,22.884488207477784
Hindhu,Bangladesh,multifactorial,Yes,drug and psycotheraphy,Experienced,negative attitude,91.27488790939778,24.901609475412297
Hindhu,Bangladesh,"Stress, Depression, economic pressure",Yes,,Experienced,,91.09008881319764,24.59503033930139
Islam,Bangladesh,Childhood trauma,Yes,,Experienced,,91.60661283,23.97698783804816
Islam,Bangladesh,Don't know,Yes,Counselling and medication,Experienced,,88.71365673677215,20.938548318779247
Islam,Bangladesh,Environmental,Yes,Proper support from the environment and will power,Experienced,I was called weak singled out from classes for having a panic attack after being scolded Infront of everyone around me me for 2 hrs strainf after 1 month of torture,92.39139851358067,23.046372415279592
,Bangladesh,"Environment, toxic social environment, lack of awareness/openness about psychological issues",Yes,,Experienced,"Hush, hush; we don’t talk about that.",89.19729637,22.182056910733028
Islam,Maldives,"Childhood trauma, family society. Overall what a person goes through in life",No,At the end of the day no matter what you still want to jump off that cliff and die,Witnessed,My friend got diagnosed with ADHD and depressed. Her family started to discriminate her and call her mentally ill and unstable.,73.09330513102266,3.0206257513390544
Islam,Maldives,"Genetics, environment",No,Never seen it work,Witnessed,Gossiping about the person,72.99161758686697,0.6177778894460596
,India,combination of environmental and genetic factors,No,"not treated, as there is a biological component to them that is described as being deterministic. on the other hand, i believe the disorder and it’s symptoms can be controlled",Witnessed,"yes, those on the ASD getting marginalized at school",83.98378687474252,31.12976118304929
Agnostic,India,I believe in the biopsychosocial model of health for the most part,No,Some can but most are not treated as much as they are managed,Witnessed,People unable to understand the different brain functioning of neurodivergent people,94.08167515577645,31.715509133234555
Hindhu,India,Not enough money,No,Because the problems that causes the mental health conditions,Witnessed,Boys can’t crying,93.71019161837715,17.347516869568373
Islam,Maldives,People,Yes,"Therapy, medication, being supportive and kind",Witnessed,When the person socially withdraws oneself  from a social gathering  he or she was labeled and someone who  is rude. When shared about depression  and anxiety issues people judge. People say that he /she is seeking attention or needs to man up,73.63276830155613,5.093783907939202
Islam,Maldives,Ignorance towards the existence of mental health issues and the stigma surrounding it.,Yes,With the right therapy and treatments the effects can be minimised but the people might not be healed fully,Witnessed,"When a person is seen to be showing signs of mental illness or are facing mental health issues, people tend to say that they are insane or it's all an act to gain attention uon",73.62871287763292,3.3964474650004806
Islam,Maldives,Genetic and lifestyle related causes,Yes,,Witnessed,Unfair treatment within the job sector,73.34922652512888,0.5911710480645521
Islam,Maldives,"Childhood trauma, unable to talk about feelings",Yes,With therapy and proper care,Witnessed,They just straight up dismiss saying its not real. Just praying and having faith will make it better,73.04172369875803,0.1494157290615803
Islam,Maldives,"Traumatic experiences, financial instability, stressful situations, genetic predisposition, any physical injury especially to the brain",Yes,By educating the public and making them aware,Witnessed,The person was labeled as stubborn and someone who brings creates chaos within the family for how she acts since she went through a traumatic injury while giving birth,73.33076806848734,3.089072094348475
Islam,Maldives,Not accepting that its a mental health issue,Yes,,Witnessed,That she is being dramatic to avoid responsibilities,73.14586946641812,0.00614159
Islam,Maldives,"It is a disease condition same as any other medical condition.can cause due to many reasons such as stress full life, trauma, family history etc",Yes,Many therapies and medications are available to treat ment health conditions. Ofcourse relegious practices will definitely help to go through it.,Witnessed,Still there are people who believe that mental heath problems are faced by those people who are less faithful,73.67525338166912,4.970134434444644
Islam,Maldives,Lifestyle and upbringing,Yes,With proper Diet and exercise and self-awareness,Witnessed,Some people do not believe anxiety as a reality,72.57413863394454,4.015365595260491
Islam,Maldives,Genetics. Childhood. Tough external circumstances,Yes,Self Awareness. Therapy.,Witnessed,Some parents not believing in mental health and mentioning that prayers and religious activities is all it takes to cure mental conditions.,73.34040628725063,5.668277523112998
Islam,Maldives,"Lot of causes. Family history, environmental factors, social factors etc",Yes,"Lots of ways. Therapy, support groups, more education on self help, medications, other treatments, therapies..etc",Witnessed,"Several times where people with mental health issues are mocked and laughed at, not supported.",72.78896367,3.6646435266033204
Islam,Maldives,"Lack of emotional support, care from friends, spouse and family",Yes,Understanding yourself better and exploring new things. Happy time spent with loved ones.,Witnessed,Self doubting and lack of confidence,73.50419101233899,1.2956186133715573
Islam,Maldives,,Yes,With the access to resources the conditions can be treated. Not gaining access due to expenses and lack of experts of the field is seen to be the biggest issue.,Witnessed,Seeing people mental health conditions invalidated and told that “people have it worse in their life”. Seeing people with diagnosed mental health conditions given unsolicited advice such as to “get over it” or “stop thinking too much”,73.46070848552804,0.9079798510117324
Islam,Maldives,"Various causes. Genetics, Nurture, etc",Yes,"Counselling, Psychotherapy, Love and support, medication",Witnessed,People verbally and emotionally abusing them. Calling students who misbehave bad.,73.57550465176229,2.6214568810551975
Islam,Maldives,"Genes, inherited generational trauma?, stigma surrounding therapy and getting help",Yes,"Therapy, medication",Witnessed,People don’t understand exactly how debilitating depression can be and often just regard it as laziness. Have witnessed situations where they dismiss a person with depression as a lazy person and refrain from inviting them to places/ giving responsibilities etc,73.57136020583869,6.804307677062036
Islam,Maldives,Demonic,Yes,,Witnessed,,73.14142515643414,2.861934989029239
Islam,Maldives,Hormonal imbalance in the brain,Yes,,Witnessed,,73.59572133947128,0.8830996204619667
Islam,Maldives,,Yes,Medication and counseling,Witnessed,,73.25163207072377,1.9927352617764162
Islam,Maldives,,Yes,,Witnessed,,72.87019524092788,-0.539542837
Islam,Maldives,Societal issues,Yes,,Witnessed,,73.04751445228081,3.048024118053479
Islam,Maldives,Socioeconomic conditions,Yes,Proper access to psychologists and psychiatrists,Witnessed,,73.09041038267702,2.6294160231067485
Islam,Maldives,Trauma,Yes,,Witnessed,,72.9763311,-0.461543535
Islam,Maldives,"Multifactorial. Environmental issues, family issues, social issues",Yes,People with me talk health conditions can seek for professional health rather than being silent and thinking that you are just different and there's nothing you can do about it,Witnessed,,72.73323558319998,-0.402086407
Islam,Maldives,The experiences they have gone through,Yes,With the right help it can be treated,Witnessed,,73.11315934845126,5.007706007650628
Islam,Maldives,nature & nurture,Yes,"by therapy, medications etc",Witnessed,,72.72175552,6.025843405338479
Islam,Maldives,"Stress, poverty, trauma, abuse",Yes,By seeking help,Witnessed,Many incident within the family of the person,73.31785799,-0.545851583
Islam,Maldives,Biological and social causes,Yes,,Witnessed,"Lot of situations where people relating mental health issues to not being religious enough, or people seeking attention, a lot other reasons",72.76757213,3.882594176619015
Islam,Maldives,Less socialising,Yes,Sharing your difficulties to another person,Witnessed,"Loss of appetite, less talking",73.20944924046348,4.221790980748272
Islam,Maldives,"Financial, Environmental, Social",Yes,"Depending on severity, counsel and/or medication.",Witnessed,"It's always a one-shoe-fits-all situation where if you think you need a psychologist or psychiatrist you're already in need of a mental asylum. This thought process prevented my mom from getting help for post partem for over 10 years and by the time she actually did, she already developed several other mental illnesses due to it and required heavy medication to function",72.72531018,4.152928404108843
Islam,Maldives,"Childhood trauma, bullying, intense pressure from family, social media",Yes,"Therapy, medications, self care like exercising, journaling etc",Witnessed,"Intense anxiety and depression due to pressures of med school and when my friend went to her parents to talk about it, they said it’s because she is not religious",73.39237234421317,3.620819961881628
Islam,Maldives,Genetics along with environmental factors,Yes,By seeking professional help and taking medications,Witnessed,"I once saw man with some mental health condition being very aggressive and difficult to handle on the road, where his family was trying to calm him down but the bystanders were laughing and they even took pictures and videos of that man.",72.85002094935115,2.629617801115278
Islam,Maldives,Traumatic Past or Born with it,Yes,Therapy,Witnessed,I have a Bi-Polar friend who would flip out on little things sometimes and cut connections for a week or so.,73.70640288846467,4.979585980751315
Islam,Maldives,Genetic + psychological + social factors,Yes,Therapies and medications,Witnessed,Have seen relatives with mental health condition (paranoid personality disorder) called crazy,73.33137351234929,5.833101688737432
Islam,Maldives,"Genetics, environment, trauma etc",Yes,With the right help and support,Witnessed,Harassing someone for their mental health issues,73.22301588431355,3.870776105180324
Islam,Maldives,Trauma,Yes,Therapy,Witnessed,Friends. Still going through mental health problems. One of them is a psychologists,73.59243007998717,0.4916507755993248
Islam,Maldives,Genetics and environmental factors such as upbringing,Yes,Therapy and medicine,Witnessed,Described them as being weak or faking it,72.54672881476773,2.2305792222704808
Islam,Maldives,,Yes,"Throught counselling, therapy, medication and life style changes",Witnessed,Denied access,72.65447409372774,1.870957171
Islam,Maldives,Various factors within your environment and so on,Yes,The world of modern medicine is quite advance. Some conditions might not have a cure. But there are treatments for majority of conditions as far as I know.,Witnessed,"Certain groups of people, mostly the older generations don't take it seriously. People get made fun of or are called crazy.",72.53499135408973,5.458041083371601
Islam,Maldives,"Injuries, trauma, pressure",Yes,By getting the desired medical health and support from family members,Witnessed,Bullying most of the time.,72.62594280552516,0.5909585
Islam,Maldives,"Stress and anxiety, rigid family problems",Yes,"Social Harmony, psychological consultancy",Witnessed,Bullying,72.82985803733882,6.4032947657064785
Islam,Maldives,"Lack of validation from teachers in school, family pressure and low self esteem",Yes,"It’s like any other disease, if not cured completely, symptomatic treatment can be given to alleviate symptoms.",Witnessed,"At work, a coworker was singled out as incompetent at the job because they were on medications.",72.96767284935922,5.337005950847503
Islam,Maldives,Trauma that one faced at some point of their life,Yes,They need professional care and care and live from the people around them,Witnessed,Anyone that is professionally diagnosed with a mental health condition is labeled as crazy and people tend to stay as far away as possible from them,73.54881972542663,6.131953240328986
Islam,Maldives,"Environment, life events.",Yes,With medication and therapy and willingness to get better,Witnessed,A person with social anxiety was ridiculed for needing assistance to pay the bill.,73.53692069508486,6.731947876804236
Islam,Maldives,"Stressful life situations,  traumatic experience",Yes,"With proper therapy, medications and support from family and community",Witnessed,"A person who is not very out going is labelled as lazy, arrogant and not caring for",72.98657371,2.3992965632677192
Islam,Maldives,Due to an unpredictable bad situation,Yes,,Witnessed,A mother's child dies during the birth and she got divorced during the day's of death of the baby,73.05374295175037,3.6091886008467013
Islam,Maldives,Anyone can have mental health condition. There's no specific cause. Could be genetic even.,Yes,With therapy and medication i believe some condition can be treated or controlled,Witnessed,A lot of people have said people with mental illnesses are crazy or weak. The way they see a person changes.,72.89662760947584,2.514539394331827
Islam,Maldives,The amount of people living in denial and people who don’t acknowledge people with mental illnesses,Yes,If given the needed consideration and the treatment (therapy. Etc) being available and affordable,Witnessed,A friend of mine. People bully her when she tells them that crowds overwhelm her,73.47275176167227,1.9648484818602605
Islam,Maldives,"Many things but usually pain, trauma, genetics, toxic upbringings,",Yes,"It can but first we need to understand what it is. A lot of mental health is deemed as irrelevant and it is not translated into languages such as Bengali/Maldivian. So for those that do not speak English, mental health is nothing",Witnessed,A family member was beaten as a child and as they grew older they rebelled. It eventually led to them committing suicide as their mother tongue was not strong so they couldn’t effectively communicate with their parents as mental health was not widely known about like other illnesses such as diabetes etc,72.56528775409963,2.3208722892354166
,India,"Strict culture, parents, and religion",Yes,Medication,Witnessed,Yes. People with depression are dismissed as being valid,93.30109528142636,36.12789656084494
Islam,India,"Family,Social and financial crisis",Yes,"Yes, a psychiatrist can cure one's mental conditions as well as a doctor cures the physical illnesses",Witnessed,Yes my granny was patient of Alzheimer and she even had been forgotten her name and identity,69.91720487717502,6.519921751019892
Hindhu,India,"lack of sleep, mutations, situations",Yes,with proper awareness and facilities yes mental health conditions can be treated,Witnessed,"when someone was crying, their mom said stop crying you're an adult",81.31981880223196,31.81726916094967
Hindhu,India,"Depends on case to case, it can be environment, genetics and even personal beliefs to some extent.",Yes,by therapy and medications (if needed),Witnessed,they don't believe that mental health problems is even actual problem.,72.79269718,11.709257079272174
Hindhu,India,Lots of factors,Yes,,Witnessed,They are looked upon differently,91.06947558977662,37.08429695198813
Hindhu,India,Psychosocial and biological [my idea is inclined towards bio-psychosocial explanations],Yes,,Witnessed,"The stigma of mental illness is deep rooted. 1. when I was interning for my Masters degree at a hospital, my family used to taunt me by saying 'you will also become one as you are mixing with them'. 2. when I conducting field work for my PHD at an OPD of a clinic (the details are published in a paper [Banerjee, B., & Dixit, S. (2021). Perceived Stigma among family members of persons suffering from mental illness: A narrative exploration from West Bengal, India. The qualitative report, 26(4), 1309-1330.]. There I depicted some of my experiences. 3. I have observed that there is some level of hesitation in people talking about mental illness. Even in academic community scholars from other discipline avoid discussion related to mental illness. However, these are my perception only.",71.00859874672005,16.376253743879424
Other,India,Changing lifestyle which getting more and more tough and increase in the competition in the market,Yes,By seeking therapy,Witnessed,Someone ik was diagnosed with depression and was kinda outcasted by her relatives,79.60402826466337,19.566071796031594
Hindhu,India,Disturbance of day to day activities,Yes,"To help of counseling, psychotherapy and medications, yoga, meditation",Witnessed,"Some people are believe that, the society is not accepted abnormal behavior, also it's not deases it's punishment for bad karmas",79.06014408104815,23.07786980607814
Hindhu,India,Overthinking and stress,Yes,By therapy and listening.,Witnessed,Seen a person facing trauma,83.17453210643411,10.30834360433176
Hindhu,India,Feeling of dissatisfaction with all aspects of one’s life,Yes,They can be treated and a person can achieve normal and healthy lifestyle,Witnessed,"People with mental health conditions often try hard to keep, they seeking help a secret and continue to be in a state of denial about it. Usually due to the fear that they will be outcasted from the community",72.74740808617142,31.950833580671215
Hindhu,India,"The reasons for mental health conditions is spread over a wide spectrum, the reason could be genetic, social life, parenting, etc.",Yes,"The treatment for various mental health conditions needs to be tailored accordingly, but i think meditation/workout, and optimistic attitude work best.",Witnessed,"People with mental health conditions are treated and seen differently, it was during my summer vacation when I joined a dance class. One of the kids was autistic, the other kids ignored him or made fun of him.",78.21311343278182,23.01554743981245
Hindhu,India,Breaking trust or betraying,Yes,"With some professional help, and some therapy",Witnessed,"People who have depressed and anxiety, people just think they can't be happy or anything",76.44143573459503,26.421601933594403
Hindhu,India,Multiple reasons can be there like daily life stress etc,Yes,By consulting to a psychologist or therapist or psychatrist,Witnessed,People usually treat them harshly as if they are insane and not a part of our society,92.63707445826357,25.173914994098084
Hindhu,India,"It could be partly genetic or biological, but I think it majorly stems from environmental reasons, and depends a lot on the support system around, and how nurturing it is, in general",Yes,"By taking professional help, like going to a therapist, or by taking meds, if it is severe, and learning coping mechanisms",Witnessed,People have judged at parties or other events when one of my friends said that they are planning to take therapy,85.06640738919103,29.814532660214503
Islam,India,"Various - early childhood experiences, social/environmental factors, trauma, finance, genetics, health/medical conditions",Yes,"Various ways: exercise, sleeping well, wellness apps, gratitude journals, having a support social network, eating well, counselling or medication,minimising time spent on social media, mindfulness, meditation/praying",Witnessed,"People gossip, due to stigma people are not willing to talk about their experiences, people have lost out on job opportunities. Colleagues are not willing to spend time with a person with mental health condition or are extra cautious in what they say. Being called derogatory names or mocked at usually by older family members",91.60690511699701,36.333091551765534
Christian,India,Sometimes it maybe due to the genetics or/and environmental factors (eg: past trauma),Yes,"If detected early and with right kind of treatment, mental health conditions can be improved, if not completely treated",Witnessed,"Often times I've noticed that depressed people, especially teens and children are thought to be acting up or being difficult or that help for mental health is only for the 'mentally derranged'. One such incident being a friend mine wanted to seek professional help as she was feeling a lot of academic and personal life pressures, but her parents were appalled and refused as they vehemently retorted that no daughter of theirs is 'mad' and needs to go to a doctor.",89.37959685049225,29.831720661589017
Hindhu,India,"Biological, social or psychological causes",Yes,Through therapy,Witnessed,"Normal discussion in the family about people suffering from mental illness and words like mad, crazy, idiots and nothing serious for conditions like depression were used. A person is considered weak If they ask for help was common opinion.",69.32531053320675,6.722890552514418
Atheist,India,Lack of communication,Yes,By visiting a good specialist,Witnessed,,76.11695564,30.62592637073172
Hindhu,India,Poor awareness and relations with people,Yes,,Witnessed,,69.53789388,18.213838186246875
Hindhu,India,stress,Yes,if given proper care it can be treated,Witnessed,,79.00461480557544,22.249827952967358
Hindhu,India,stress,Yes,if given proper care it can be treated,Witnessed,,85.63195756232841,28.81349133502343
Islam,India,"Cultural pressures, finances",Yes,,Witnessed,,76.99971516231626,10.499580316105853
Sikhism,India,Stress,Yes,"Family support, emotional support, more awareness among people, proper medical treatment",Witnessed,,96.22361218182864,18.17427040771684
Hindhu,India,Emotional supression,Yes,It is must because crime and mental health are increasing day by day,Witnessed,,74.37237593021358,24.455124081308178
,India,Stressful life situations,Yes,,Witnessed,,68.59427705,13.652116683135127
Hindhu,India,"It is a combination of biological, physiological, psychological and social factors",Yes,"Yes, but not completely. Various treatment options can be applied including counselling, psychotherapy, pharmacotherapy",Witnessed,My younger sister was bullied in school for being dyslexic.,88.64701255375668,33.83042033027824
Hindhu,India,"several factors, considering genetics and the environmental conditions and situations.",Yes,it is treatable with appropriate professional help,Witnessed,my sister's friend is going through a difficult phase and is diagnosed with depression because of which she is unable to attend her classes. her friends who know about it make fun of it in class and believe that she is doing it for attention.,95.44305338327169,33.169563545666854
Hindhu,India,"Several factors, genetic or environmental factors",Yes,With professional help from trained specialists,Witnessed,My sister's friend has been diagnosed with depression but her friends feel that she just wants attention,81.92839378173417,33.77700128
