Hindhu,India,,Yes,With seeking professional help,No,,94.60840317098015,20.447250593265913
Hindhu,India,Not applicable,Yes,,No,,72.96556161010145,7.296314785022307
Hindhu,India,Overthinking,Yes,,No,,74.10567238833761,34.83223924263858
Hindhu,India,"Overthinking , stress & anxiety",Yes,By helping the individual from the situation.,No,,80.93796743428227,27.949388490243003
Hindhu,India,Past experiences/ History,Yes,Therapy and exercises,No,,68.25389916136137,26.45120173325236
Hindhu,India,Past trauma,Yes,Therapy,No,,94.41168647712581,15.169977208787996
Hindhu,India,Present lifestyle stress anxiety depression,Yes,It can be treat with therapy taken from a therapist,No,,73.84722626773319,11.254718665550651
Hindhu,India,Pressure,Yes,Clinical,No,,71.72376541101424,22.432666556260685
Hindhu,India,Prolly passing on trauma,Yes,,No,,72.80799138620976,30.519204018053216
Hindhu,India,Social pressure,Yes,By talking to a professional or a friend too,No,,92.29248777392435,31.967313898565685
Hindhu,India,Society,Yes,By systematic counselling,No,,91.33446772890787,16.764188261968656
Hindhu,India,Society,Yes,Having someone to talk with,No,,68.90618239883884,10.565471734507321
Hindhu,India,stress,Yes,study the root cause and analyse.,No,,85.37642531,31.24038040854152
Hindhu,India,Stress,Yes,,No,,85.26144180146711,16.087998732123655
Hindhu,India,Stress,Yes,Through careful evaluation and constant care,No,,72.69081230407224,23.070350688287597
Hindhu,India,"Stress, any childhood or emotional trauma",Yes,"Therapy , interacting with your close people",No,,92.14084732917183,6.9536399012401535
Hindhu,India,"Stress, diseases",Yes,,No,,83.09936320211088,7.440364636836208
Hindhu,India,"Stress, Past Trauma",Yes,Therapy,No,,69.13143276,26.75247491616114
Hindhu,India,"Stress, Triggers, trauma (childhood or adulthood)",Yes,"Medication, therapy",No,,87.44559373089628,7.436802355667437
Hindhu,India,"Stress,genetics",Yes,"Counselling, medicines",No,,72.18599486991877,10.018203232138664
Hindhu,India,"studies, work pressure",Yes,believe,No,,92.72671509759846,23.74656752385433
Hindhu,India,Surroundings,Yes,With appropriate care mental health can be treated,No,,83.10247487125925,7.504099678926077
Hindhu,India,"There are a lot of causes, physical, mental, social etc. Can not pin point one.",Yes,"They can be treated. Can not make promises about curing them, but treating and managing? yes.",No,,94.33493337110286,29.588483415468772
Hindhu,India,"Trauma, abuse, stress.",Yes,Giving some time for the situation to pass and getting proper therapy can help.,No,,83.11527650011769,26.255644879157927
Hindhu,India,"Trauma, childhood abuse or neglect and awful experiences in life.",Yes,Through therapy.,No,,89.82406068,35.324354576518516
Hindhu,India,Unreal expectations,Yes,,No,,89.90279783506811,32.33230954994161
Hindhu,India,"Would say there are many, mainly your situation and your beliefs",Yes,"Talking to professionals(psychologist, psychiatrist)",No,,96.27810969,8.692975177965007
Hindhu,India,Your surroundings and circumstances,Yes,Can be treated with proper medications,No,,82.40991928324819,20.232634393475365
Islam,India,"Childhood traumas , social isolation and loneliness,bereavement",Yes,"I think they can be treated as there are many treatments you are able to do which overall in the end can work , some treatments work for others but some don’t do you have to see which one works best for you.",No,,69.65154901845071,15.175020418485449
Islam,India,"Environment, genetics, life experiences, negative thinking patterns, unhealthy habits",Yes,By seeking mental health professionals,No,,76.01565902032371,12.974644321780405
Islam,India,"Social and personal Environment, maladaptive coping strategies, stress, parenting techniques used on one as a child",Yes,Psychotherapy can help treat mental illnesses.,No,,86.18074347012822,27.287585681620264
Islam,India,Stress,Yes,Through professional help,No,,76.42871173,36.85146724
Islam,India,Stress,Yes,Through professional help,No,,87.30539669361646,15.737811877587303
Islam,India,"Stress, Family issues",Yes,Having a discussion with close friend or family and meditation,No,,96.48787394391776,15.843417094444067
Islam,India,"Stress, Genetics, Lifestyle, Lack of Support, etc",Yes,therapy,No,,93.69098030969286,10.269135392343696
Islam,India,"Traumas, Depression, anxiety.",Yes,Therapy could be one of the way,No,,79.42648191577015,12.357984035801628
Other,India,"Genetic, Stess, General",Yes,"Medication, Counselling, Therapy, Keeping Mind busy of the Patient by engaging in different activities",No,,74.70677021854632,32.89101798914672
,India,"Can be many things include environment, stress, physical health",Yes,Therapy and medication,No,,83.45148914889347,14.81932997276538
Hindhu,India,"Heredity, culture, environment, society",Yes,Yes treatment to control maladaptive symptoms is possible. Both medication and therapy might be needed to help the person cope depending on the nature and severity of the problem,No,,68.44349689,35.79327218505699
Hindhu,India,It can be biological and environmental influence,Yes,With proper therapy and psychiatric medicines if needed,No,,96.72243048312525,14.495459096590164
Hindhu,India,,Yes,,No,,92.90278016,22.143989508475777
Hindhu,India,Stress,Yes,Therapy,No,,75.50345982425839,35.51532518345551
Hindhu,India,Surrounding conditions,Yes,By providing support from friend and family member,No,,91.22942839075907,25.479682820769952
Islam,India,"Pressure , stigma",Yes,"Therapy, less stigma",No,,80.88711102973255,16.778273384205413
Islam,India,Too much stress,Yes,By sharing things to our friends and family letting them know about the trouble you're going through,No,,70.51237413032052,14.090292172336785
Budhist,Sri Lanka,,Yes,"Therapy, Medication",No,,81.19014674817889,6.095615379096385
Islam,Sri Lanka,Expectations,Yes,"If the way of thinking of a person can be changed, then mental health can be treated",No,,80.39346851728695,8.921035987142185
Islam,Sri Lanka,Financial  or work stress,Yes,Counselling,No,,81.80258385271654,7.456255475276701
Islam,Sri Lanka,Stress,Yes,"Having a good relationship, meditation, trying to get a stress-free life",No,,80.24044231155764,8.087179166876496
Other,Pakistan,"Domestic issues, Financial dependence, child abuse, harassment, even ongoing disturbed circumstances in Palestine, Sudan and Congo",Yes,"Yes it can be treated by various techniques like psychoeducation, therapies etc.",No,,75.96052807358257,34.78211020346296
Other,Pakistan,Environment,Yes,,No,,62.16524112600685,35.435410900182134
Christian,Pakistan,Stress,Yes,,No,,76.16902809420311,35.02968101575607
Islam,Pakistan,Anxiety,Yes,Yes...through medicines and therapies it is possible,No,,66.22489465246662,26.64632930229466
Islam,Pakistan,Any external issues may,Yes,By therapy maybe,No,,76.93424021033796,33.68007468872755
Islam,Pakistan,behaviour of society,Yes,if discussed with professionals,No,,66.58992049136215,28.591680430472707
Islam,Pakistan,Being away from religion particularly Islam,Yes,"Having Faith on Allah, counselling, acknowledging that I have a  disorder...",No,,69.47355671,29.479820242251307
Islam,Pakistan,"Childhood abuse , trauma, neglect",Yes,"There are many different treatment options available . individual can chose the treatment or combination of treatment, which works best.",No,,64.02114833133905,30.00402321799272
Islam,Pakistan,Constant criticism on a person in his childhood,Yes,,No,,72.50166479621517,26.331644589227444
Islam,Pakistan,Current issues like expensiveness,Yes,With medical equipment and remove stress,No,,74.57157294250071,35.724241779741604
Islam,Pakistan,Depression,Yes,,No,,74.12698914778431,24.029401191901606
Islam,Pakistan,Depression,Yes,,No,,74.73908447,31.694244848839908
Islam,Pakistan,Depression,Yes,By the treatment from psychiatrist & psychologist,No,,76.16322415262091,36.26675815804039
Islam,Pakistan,Depression,Yes,By the treatment from psychiatrist and psychologist,No,,62.57203039890076,25.204168745631282
Islam,Pakistan,Depression,Yes,My counseling it with a professional,No,,76.76380334011036,33.41555387010342
Islam,Pakistan,Dippression,Yes,Psychotherapist  medication hospitalization.,No,,61.268882361461976,29.27766905722806
Islam,Pakistan,Domestic problems,Yes,Through proper consultation and therapy sessions,No,,69.57854413962053,23.926905616139518
Islam,Pakistan,Environment,Yes,Bcz of environment,No,,61.941018997907015,28.66779589023524
Islam,Pakistan,Environment,Yes,Psychological therapies can be helpful,No,,67.84053317169742,24.517122586058456
Islam,Pakistan,Environment in which people live,Yes,With conversation hearing other thoughts,No,,70.31612242466872,24.108072786804055
Islam,Pakistan,"Excessive Social media use, toxic relationships",Yes,,No,,74.56053696047894,30.57313125497389
Islam,Pakistan,Expectations & Ignorance,Yes,,No,,70.11484092073438,30.198904800381644
Islam,Pakistan,Family behaviour or society behaviour,Yes,By ignore them,No,,64.63256576126565,30.596315342836565
Islam,Pakistan,Family issues,Yes,,No,,74.24195906470514,27.871754481177344
Islam,Pakistan,Family issues and pressure,Yes,By guidance and seeking a psychologist,No,,67.23197703,32.12928441734618
Islam,Pakistan,Fight between parents,Yes,By offer prayers,No,,67.47628674327397,23.94390514920057
Islam,Pakistan,I believe the main cause is our environment and people lives around us.,Yes,I think of course with the help of good behavior,No,,74.16233987,35.94985472851262
Islam,Pakistan,I guess childhood trauma's is the main caused,Yes,Except shezophrenia the other mental heath issues can be treated through therapy,No,,75.76137737,26.337264521218213
Islam,Pakistan,I think its biggest cause is lack of communication and understanding,Yes,"Yes it can be treated by the of people around the person, by communicating and discuss the problems",No,,77.21025980184884,36.621366344781535
Islam,Pakistan,Lack believe from Allah Almighty,Yes,"It is treated by therapies,medication etc",No,,75.02351154988997,29.75151585172545
Islam,Pakistan,Life trauma,Yes,By acknowledging it and trying to work with it so it can't control you,No,,61.212003030242826,29.89595836820623
Islam,Pakistan,Many reasons,Yes,Through treatment,No,,70.74832325870439,25.346411140011224
Islam,Pakistan,Mental health cause by our environment and also ones mind badly affect by situation and many more tension of every day in pakistan these matters are alot,Yes,Yes treated,No,,74.34991299236094,23.848379711211763
Islam,Pakistan,,Yes,,No,,72.85973307221413,24.936587032333478
Islam,Pakistan,,Yes,,No,,72.94568131098288,34.9481408
Islam,Pakistan,,Yes,,No,,62.16135505900196,36.82969232854017
Islam,Pakistan,,Yes,,No,,61.70222942837939,25.814603793406594
Islam,Pakistan,,Yes,,No,,71.37868055085288,33.93253082565336
Islam,Pakistan,,Yes,,No,,72.02952947283629,33.56444382308163
Islam,Pakistan,,Yes,Because of psychologist session,No,,69.59421591595972,24.34001442
Islam,Pakistan,,Yes,If proper check the doctor it is treated,No,,74.29773420231794,24.165796747805878
Islam,Pakistan,,Yes,Yes because the stressed person adopt mental health conditions,No,,66.17880571609693,35.839129809016846
Islam,Pakistan,Nill,Yes,,No,,70.74425735656924,27.931320935453265
Islam,Pakistan,Nope,Yes,Yes it effects on humans to much either its bad or it's good,No,,70.58715017,24.167814398158978
Islam,Pakistan,"Not a specific cause.But i guess the environment, parents and society around us.",Yes,I think by attention.By giving time to patient. Trying to understand and showing affection to patient.,No,,62.868211170194755,24.337361381126087
Islam,Pakistan,Nothing,Yes,By knowing these problem,No,,75.90684105189317,31.723947080795092
Islam,Pakistan,Overthinking,Yes,,No,,74.60232882958022,35.96944198329075
Islam,Pakistan,Poor sleep,Yes,,No,,75.45909184248866,26.253214972552506
Islam,Pakistan,Poverty,Yes,,No,,61.26006634177839,28.161114436611278
Islam,Pakistan,Pressure from the society and tough competition among masses,Yes,By providing counselling and rehabilitation,No,,65.16886377792834,37.033597817706124
Islam,Pakistan,problems,Yes,,No,,73.97149786844744,34.16455274783483
Islam,Pakistan,Repressing initial signals and constantly brushing our little problems under the carpet.,Yes,"It depends on the severity level, if someone gets help at earlier  stages then more chances to become healthier as before.",No,,69.65429936,37.01276619289925
Islam,Pakistan,"So many things contribute to it. Sometimes childhood traumas are cause behind this. In our daily life we go through so many problems like physical health, job issues, child abuse etc may become the cause of mental illness.",Yes,It can be treated but we can not complete mental health restore because in ur society other people not help to mentally unstable person as much as he need. If we help him in a better way we can take him towards normal life like others,No,,73.51693528716802,27.827512485647066
Islam,Pakistan,Social loneliness,Yes,By psychological therapies,No,,67.93031665,30.643674022854633
Islam,Pakistan,Society behavior,Yes,To be relaxed,No,,74.21060291580693,34.02858319377971
Islam,Pakistan,Society issues,Yes,With the help of psychologists,No,,66.3448759,35.77444095
Islam,Pakistan,Society pressure,Yes,By taking proper medication from a therapist and with seeking help from Allah Pak,No,,72.85698341129567,34.31614908410596
Islam,Pakistan,Some tramatic condition,Yes,Due to tharapies and medicine,No,,73.23580418,33.569697678845856
Islam,Pakistan,stress,Yes,,No,,77.09377774552206,25.177431183917204
Islam,Pakistan,Stress,Yes,By seeking doctor,No,,61.87806945,29.894771735672375
Islam,Pakistan,Stress,Yes,Can b treated by therapy nd medication,No,,66.10698146639854,31.923913962363258
Islam,Pakistan,Stress,Yes,Family company and proper diagnosis,No,,63.933106146643254,31.277179807653035
Islam,Pakistan,Stress,Yes,Gradullay but with care,No,,77.09371870563601,26.653895377882957
Islam,Pakistan,Stress,Yes,If ur mental health is on initial try than it can be treated,No,,75.33618552,35.32656491094848
Islam,Pakistan,Stress,Yes,Rehabilitation,No,,71.47148368,32.379999605904146
Islam,Pakistan,Stress,Yes,Treated by consullenig,No,,69.74568310065557,32.81986101698804
Islam,Pakistan,Stress,Yes,Yes but not for forever,No,,69.17175005574033,32.11850762221697
Islam,Pakistan,Stress,Yes,"Yes, by proper medication",No,,62.67611611418862,26.77881928463828
Islam,Pakistan,Stress or depression,Yes,By proper counselling,No,,61.09587146335353,27.038446982060357
Islam,Pakistan,Tanuting,Yes,Providing the right atmosphere,No,,71.08655067,34.05552583030136
Islam,Pakistan,Tension,Yes,,No,,73.16072242413662,36.98274365953407
Islam,Pakistan,Tension,Yes,,No,,76.28774382510566,27.56425761820798
Islam,Pakistan,Tension,Yes,By providing free talk,No,,64.89327794139717,36.437485465700256
Islam,Pakistan,"These include biological factors (e.g., brain trauma), psychological factors (e.g., stressful events), and sociocultural factors (e.g., poverty). A family history of mental and addictive disorders also can increase risk.",Yes,"Psychological therapies can be helpful for most people affected by mental health issues. For some mental health conditions, medications can also be helpful. Other support options include counselling, peer support, and community support services.",No,,67.45742089156414,32.614286354579924
Islam,Pakistan,Thinking pattern,Yes,Under psychiatric care and due to proper counseling,No,,64.44049257295437,29.493538676601798
Islam,Pakistan,To much stress,Yes,By relaxing some one and gave him all the need he want,No,,67.04634468107582,32.66357389727689
Islam,Pakistan,Traumatic events and hypertension,Yes,We can treat them . But it is slow process.,No,,66.43118275152183,33.20090163744889
Islam,Pakistan,"Truma ,complex",Yes,,No,,69.84239778186937,31.231030212523763
Islam,Pakistan,Unpleasant environment,Yes,By doing the things which make u feel relax,No,,72.18429085388925,36.03359302417092
Islam,Pakistan,Yes i believe,Yes,Psychologist can treat mental health,No,,61.21408896562567,31.76397983582431
Islam,Pakistan,Depression and don't share the problem with special ones,Yes,,No,,71.58077962882663,26.253640338495998
Islam,Pakistan,Mental health,Yes,,No,,68.83914359247753,35.33757000191131
Islam,Pakistan,Societal approval in any case,Yes,Different yardstick used to treat it either it is therapies with psychologist or through medication by physicatrist,No,,65.58143332012226,23.812415930432092
Islam,Pakistan,"Anxiety, depression",Yes,,No,,74.05741524,29.743311451081198
Islam,Pakistan,Better with medicine and good environment,Yes,Good through medicines and environment,No,,64.40343913259986,28.821049992784534
Islam,Pakistan,Depression,Yes,Some treatment or medicines are available for mental treatment,No,,77.39549851136269,31.260294458874064
Islam,Pakistan,Depression,Yes,Yah of course it can be treated through a proper treatment,No,,69.26608240367857,32.780539964243175
Islam,Pakistan,Depression,Yes,"Yes, by proper medication and Care",No,,70.83699927403282,35.09515011368001
Islam,Pakistan,Depression and stress,Yes,Yes,No,,63.030429795267224,27.97914368274124
Islam,Pakistan,Depression is main key of mental health conditions,Yes,By counseling and rehabilitation,No,,70.77551569087345,32.06367157053143
Islam,Pakistan,economic issues,Yes,,No,,68.72721655818444,27.107364829456703
Islam,Pakistan,"Environmental factors, family, social relationship issues",Yes,With therapies counselling and taking medication,No,,67.26226807,34.402141082692324
Islam,Pakistan,Environmental issues,Yes,,No,,69.70145028,34.55438362909884
Islam,Pakistan,Family crisis,Yes,By resolving main cause,No,,75.47743854495762,30.119653146939577
Islam,Pakistan,"Family pressure, comparisons with others, complexity",Yes,By providing healthy environment,No,,65.32836698804734,32.49891771
Islam,Pakistan,In my opinion its become hectic .,Yes,In certain conditions person loss their mental health but it must be treated and best way through love and affirmation.,No,,73.94297191465043,29.271179271851764
Islam,Pakistan,it can be cure able i guess,Yes,with patience,No,,72.76877248577419,36.95999963
Islam,Pakistan,Multiple reasons,Yes,,No,,70.53030462525992,28.0458869
Islam,Pakistan,,Yes,,No,,61.39269973894361,33.29167260939032
Islam,Pakistan,,Yes,,No,,67.13428928995013,33.19214754487433
Islam,Pakistan,,Yes,,No,,69.68267449053928,28.190188579631698
Islam,Pakistan,,Yes,As good and friendly environment,No,,70.24322207534283,26.237751615641486
Islam,Pakistan,Nurture,Yes,By improving lifestyle,No,,76.15059717,28.146519255664096
Islam,Pakistan,People,Yes,,No,,75.4115183,35.26605589865281
Islam,Pakistan,People not minding their own business,Yes,"Therapies, counseling",No,,74.63572539945156,29.679683689245085
Islam,Pakistan,Stress,Yes,Yes through treatment,No,,65.53346560104748,30.06462152182816
Islam,Pakistan,Stress childhood trauma or any problematic situation which are unable to overcome,Yes,With professional help and guidance,No,,69.41404068156939,25.096610138623102
Islam,Pakistan,The biggest cause is I think environment. Genetic factors are also involved.,Yes,"Yes, with a formal treatment and a supportive and caring environment",No,,63.89210724765356,26.70508777940328
Islam,Pakistan,The cause of mental health is not getting the proper attention. I'm not saying that every mental illness is due to this,Yes,It can be treated and can lead to better health conditions by focusing on the treatment. The support of the family matters alot.,No,,70.42696410868037,28.58768041
Islam,Pakistan,Toxicity of relationship and parents pressure to get good grades,Yes,,No,,68.15271552463406,28.37319842863439
Islam,Pakistan,Unhealthy events,Yes,Can be treated with the help of mental health practitioners,No,,63.75323587404855,30.507963369466268
Hindhu,Nepal,Environment and Brain Chemistry,Yes,It can be treated by psychotherapy.,No,,82.16033391763149,27.659688245446088
Hindhu,Nepal,"genetics, environmental factors, stress, disturbed sleep,",Yes,"psychosocial counselling, CBT, Pharmacotherapy",No,,87.58886289597113,28.222965390729907
Hindhu,Nepal,,Yes,,No,,84.34279236319927,29.413061113788306
Hindhu,Nepal,Working environment and career goals,Yes,By maintaining good workspace,No,,81.98594846369116,29.494537568824203
Hindhu,Nepal,Family toucher,Yes,By caring,No,,87.03748579657335,30.16727983174173
Hindhu,Nepal,overthinking,Yes,,No,,81.72596261703872,30.239096124156397
Hindhu,Bangladesh,Economical and family life and surrounding environment,Yes,,No,,89.49154003014061,23.76796538528862
Hindhu,Bangladesh,"Stress, lack of peace in family,lack of understanding between husband wife",Yes,,No,,91.91794146,22.194761754381222
Islam,Bangladesh,"Genetic, experience, trauma and ignorance",Yes,Proper treatment - medicine and non-medicine,No,,88.04738432070438,20.744991
Islam,Bangladesh,"Mental health conditions are multifaceted and influenced by a combination of factors. Biological factors, such as genetic predispositions or imbalances in brain chemistry, play a role. Environmental factors, including traumatic experiences or chronic stress, can contribute to their development. Psychological factors, such as individual coping mechanisms and cognitive patterns, also impact mental well-being. Additionally, social factors like socioeconomic status, cultural influences, and access to resources have an influence. It is important to recognize that mental health conditions are not caused by a single factor, but rather emerge from a complex interplay of these various elements. Understanding these factors is crucial for effective prevention, treatment, and support of individuals experiencing mental health challenges.",Yes,"Yes, mental health conditions can be treated. Treatment approaches may include psychotherapy/counseling, medication, and lifestyle changes. Seeking professional help and adopting a personalized approach can contribute to managing and improving mental health.",No,,89.75248149255145,24.77143332926138
Islam,Bangladesh,"Proper food,sleep,entertainment or sports",Yes,By physician or Psychologist or counseling,No,,88.37786313800402,23.437685037962847
Islam,Bangladesh,Stress,Yes,Need care,No,,88.08815549,22.464554119865106
Islam,Bangladesh,Trauma,Yes,By proper treatment,No,,90.44039779627919,25.193562574029876
Islam,Bangladesh,Various reasons depending on individual circumstances. Examples could be peer pressure that could lead to anxiety and feeling of imposter syndrome or other similar feelings that would impact mental health.,Yes,By addressing the problem through professional help.,No,,90.41750459088644,26.557065610793835
Hindhu,Bangladesh,,Yes,yes,No,,88.86976532535135,22.10835174012266
Islam,Bangladesh,Disease,Yes,Yes by doctor,No,,89.26775094,24.688775234137882
Islam,Bangladesh,I don't know,Yes,,No,,89.64322762450583,21.57517363002066
Islam,Bangladesh,overall environment,Yes,,No,,91.38871860699103,24.218544344034783
Islam,Pakistan,"I am sure it varies person to person and personal circumstances, environment etc. To me, it could be heredity, environment, trauma (both physical & mental) and biological.",Yes,"By a mental health profession, medication, self-help plan, support groups etc.",,,74.85553432657227,31.941289680576013
Islam,Pakistan,Stress of career and other family issues,Yes,By understanding and listening them,,,67.58991712623441,35.31421853426091
