Islam,Pakistan,Depression,Yes,concerned with psychiatrist,Witnessed,"Once i was in punjab clg and in our chemistry lecture, a girl came in our class and asked that anyone please help me to understand chemistry lecture and she went every class and asked everyone and later we knew that she had depression and ran away from college"
Islam,Pakistan,Nothing cause I don't have one,Yes,Yes it can be treated through Therapies and proper clinical treatment,Witnessed,Not witnessed any severe cases except mild anxiety or depression
Islam,Pakistan,Depression,Yes,"I believe, mediciation",Witnessed,N/A
Islam,Pakistan,Genetic factors and neural network disturbance,Yes,N/A,Witnessed,N/A
Islam,Pakistan,N/A,Yes,N/A,Witnessed,N/A
Islam,Pakistan,N/A,Yes,Treated by psychologist,Witnessed,N/A
Islam,Pakistan,Stress and finencial issues and relationship issue,Yes,N/A,Witnessed,N/A
Islam,Pakistan,Stress and hypertension,Yes,N/A,Witnessed,N/A
Islam,Pakistan,Stress deoression anxiety,Yes,By trying to find and solve the condition which let the person in that mental health condition,Witnessed,N/A
Islam,Pakistan,trauma,Yes,N/A,Witnessed,N/A
Islam,Pakistan,Trauma,Yes,N/A,Witnessed,N/A
Islam,Pakistan,"Genetic, Environmental, Biological and Social Factors",Yes,N/A,Witnessed,N/A
Islam,Pakistan,Society,Yes,With the help of a counsellor who may guide us how to accept and solve our problems,Witnessed,My cousin experienced depression and nobody took her serious to the point that she got ill and it took her several years to recover mentally and physically
Islam,Pakistan,An individual's environment,Yes,"Through Psychotherapy, Family support, lifestyle changes",Witnessed,I've seen that mental health issues are kept secret within families due to fear of judgement.
Islam,Pakistan,Unconditioned environment mostly,Yes,By using Psychological methods and techniques,Witnessed,I saw a person with mental health condition and mostly their reasons are family issues and they fight against it and end up by staying quite and Acceptance.
Islam,Pakistan,"The main cause is family issues , separated parents, orphans,poverty and of course genetics.",Yes,"Depending on the mental health condition, mostly they can be treated with a happy healthy home environment, cooperation of parents and family , love , care and affection.",Witnessed,I have witnessed people being uncomfortable being friends or even talking to people with mental health issues.
Islam,Pakistan,"Mental health conditions can have various causes, often involving a combination of genetic, biological, environmental, and psychological factors. Factors such as genetics, brain chemistry, trauma, and life experiences can contribute to the development of mental health conditions. It's important to approach mental health holistically, considering the interplay of these elements.",Yes,"Yes, many mental health conditions can be treated, often through a combination of therapies, medications, and lifestyle changes. Treatment approaches vary based on the specific condition and individual needs. It's important to seek professional help for an accurate diagnosis and tailored treatment plan.",Witnessed,"I don't have personal experiences, but I can share that stigma against people with mental health conditions is unfortunately common. It can manifest in various ways, such as misconceptions, discrimination, or insensitive remarks."
Islam,Pakistan,"Stress, past trauma, and pressure",Yes,"With proper care, treatment, and mediation",Witnessed,Every one in my family doesn't take my sister's mental health condition seriously and always named it as one of her dramatic episodes.
Hindhu,Nepal,Neurohormonal disbalances,Yes,N/A,Witnessed,"People teasing Schizophrenics, not considering depression, anxiety as illness"
Hindhu,Nepal,Biopsychosocial,Yes,N/A,Witnessed,N/A
Hindhu,Nepal,unknown,Yes,N/A,Witnessed,N/A
Islam,Bangladesh,"Genetics, environment",Yes,Though medicine and counseling,Witnessed,Not supportive to take counseling
Islam,Bangladesh,no,Yes,consultation,Witnessed,negligence
Hindhu,Bangladesh,"Genetic, Trauma,",Yes,Proper medication and councelling.,Witnessed,N/A
Other,Bangladesh,"Poverty, family relation",Yes,N/A,Witnessed,N/A
Islam,Bangladesh,Mostly genetics that cause chemical imbalances in the brain's signalling system,Yes,Proper medication and therapy. Medication must not significantly alter quality of life through it's side effects.,Witnessed,My sister got rejected from a university because of bipolar disorder.
Islam,Bangladesh,Depression,Yes,First we have to share our mental condition with our closest one.At the same time patients surroundings also should be sensible regarding this issue.psychiatry consultation is must.And most importantly we must have to rise awareness and pay attention to the mental health issue.,Witnessed,As a doctor I met a patient in psychiatric ward .She was 33 years old new mom.The patient party complained that she is possessed by some evil spirit because she wanted to kill his newborn with a pillow.She is a crazy insane woman and her husband totally agreed for a divorce.but this is a case of postpartum psychosis and she needed treatment immediately that time.But her family refused to go for any kind of therapy for that poor soul.
Islam,Afghanistan,"Life experience, conflict, cultural taboo, Domestic violence, forced marriage, poverty, drug",Yes,Social engagement and counselling,Witnessed,loss of spouse and poverty
Islam,Maldives,Trauma from childhood,No,Cannot be completely cured,No,N/A
Islam,Maldives,Treat well,No,Give full support from family and society,No,N/A
Hindhu,India,"Causes can be genetic, environmental or triggered by incidents.",No,"Not always completely. I believe humans always take steps backwards sometimes. One cannot be treated completely, episodes can occur again and again. What matters is how you handle/ deal with them.",No,N/A
Hindhu,India,"Daily life stress, Family issues, growing up with violence",No,It couldn't be transferred,No,N/A
Hindhu,India,N/A,No,N/A,No,N/A
Islam,Pakistan,Anxiety,No,N/A,No,N/A
Islam,Pakistan,Depression,No,No because every person has different mind set so it's difficult to understand every person,No,N/A
Islam,Pakistan,Family issues,No,N/A,No,N/A
Islam,Pakistan,N/A,No,N/A,No,N/A
Islam,Pakistan,Stress,No,Because I think some symptoms appear again  after some interval of time,No,N/A
Islam,Pakistan,I don't know,No,N/A,No,N/A
Islam,Pakistan,Money problems,No,I don't know,No,N/A
Islam,Pakistan,Overthinking,No,"By morning walk,by attach our self with nature,do duaa and zikr if allah almighty",No,N/A
Hindhu,Nepal,Excellent,No,N/A,No,N/A
Islam,Bangladesh,Economical,No,N/A,No,N/A
Islam,Maldives,Bad experiences and trauma,Yes,Therapists,No,N/A
Islam,Maldives,Bullying,Yes,N/A,No,N/A
Islam,Maldives,Decrease in level of satisfaction,Yes,Counseling,No,N/A
Islam,Maldives,Depends on the situation and the individual. From genetics to poor standard of life to trauma,Yes,N/A,No,N/A
Islam,Maldives,Difficult living situations and trauma,Yes,Availability of therapists at a cheaper level than now.,No,N/A
Islam,Maldives,Dipression,Yes,Now there r psycologists here so any one that has mental illness can be treated,No,N/A
Islam,Maldives,Don't now anything,Yes,N/A,No,N/A
Islam,Maldives,don’t know,Yes,N/A,No,N/A
Islam,Maldives,Drainage of mental health,Yes,Professional help along with support from friends and family,No,N/A
Islam,Maldives,Due to family issues,Yes,By getting support from everyone,No,N/A
Islam,Maldives,"family and friends, living conditions",Yes,Therapy,No,N/A
Islam,Maldives,Genetics and environment,Yes,Through intensive care. I believe it could be treated but rarely,No,N/A
Islam,Maldives,Genetics and Environment,Yes,Through medicine and therapy,No,N/A
Islam,Maldives,"Genetics, Environment that you grew up in",Yes,"Therapy, Medication",No,N/A
Islam,Maldives,Genetics. Circumstances in life.,Yes,Proper guidance from people around you. Affordable counselling. More mental health awareness programs.,No,N/A
Islam,Maldives,"Hereditary, psychological trauma, environmental stress",Yes,"With change in environment, therapy, medicine",No,N/A
Islam,Maldives,I think an individual’s experience’s to different situations,Yes,With proper help from professionals,No,N/A
Islam,Maldives,"lack of empathy, understanding",Yes,proper treatments and mentally strengthening your thinkinh,No,N/A
Islam,Maldives,Lifestyle,Yes,By receiving psychotherapy,No,N/A
Islam,Maldives,Living environment,Yes,By talking to someone who’s professional,No,N/A
Islam,Maldives,"Mainly, stress.",Yes,By giving the proper care and counseling,No,N/A
Islam,Maldives,Over thinking,Yes,N/A,No,N/A
Islam,Maldives,Pregnancy and Child birth,Yes,Therapy and medication,No,N/A
Islam,Maldives,Stress,Yes,By medication,No,N/A
Islam,Maldives,Stress,Yes,Guided therapy,No,N/A
Islam,Maldives,Stress,Yes,Proper diagnosis,No,N/A
Islam,Maldives,Stress,Yes,"Therapy session, with good company, taking time out",No,N/A
Islam,Maldives,Stress level at work,Yes,Consuting a couselor,No,N/A
Islam,Maldives,"Stress, trauma",Yes,Therapy,No,N/A
Islam,Maldives,Stress/ pressure,Yes, By a good conversation or from a therapist,No,N/A
Islam,Maldives,Surrounding factors,Yes,With the right kind of help and research,No,N/A
Islam,Maldives,"There are a number of reasons. Child Abuse, Trauma, Social Isolation or loneliness, Bereavement, Domestic Violence, Misuse of drugs and the list goes on.",Yes,With proper medication and seeking therapy help for some but maybe it doesn’t work for everyone.,No,N/A
Islam,Maldives,Trauma,Yes,By taking adequate therapy and following a well guided treatment plan,No,N/A
Islam,Maldives,"Trauma, abuse, stress",Yes,"Love, Medicine and psychotherapy",No,N/A
Islam,Maldives,"Trauma, physiology",Yes,"Yes, medical treatment, therapy",No,N/A
Islam,Maldives,"Trauma, self neglect, being around negative poeple",Yes,Getting therapy and starting to take care of own self better,No,N/A
Islam,Maldives,Trauma/ abuse and biological factors,Yes,Reducing stigma and With proper interventions,No,N/A
Islam,Maldives,Communication barriers,Yes,By sharing the concern and having better means of communication,No,N/A
Islam,Maldives,Childhood,Yes,Time,No,N/A
Islam,Maldives,"family problems, ignorance",Yes,with the necessary support from family and friends,No,N/A
Islam,Maldives,Genetics and environmental factors,Yes,"Psychological therapy, and medication",No,N/A
Islam,Maldives,good,Yes,N/A,No,N/A
Islam,Maldives,Instability in life which leads to all sorts of problems and unhappiness,Yes,N/A,No,N/A
Islam,Maldives,Loose in selfconfidence,Yes,By giving them more time,No,N/A
Islam,Maldives,Stress/ abusive environment,Yes,N/A,No,N/A
Islam,Maldives,Surrounding environment,Yes,"Medicines, taking therapy",No,N/A
Islam,Maldives,Trauma,Yes,Making them think positively,No,N/A
Islam,Maldives,Trauma,Yes,Praying,No,N/A
Islam,Maldives,trauma and stress,Yes,by theraphy,No,N/A
Other,India,Adjustment problem,Yes,Better choice opinion,No,N/A
Other,India,"Environmental, social, and genetic factors.",Yes,Therapy and medication,No,N/A
None,India,circumstances if not by birth,Yes,"I feel through doctors, counsellors psychiatrist all the more through ones patience",No,N/A
None,India,Ignorance,Yes,Timely intervention,No,N/A
None,India,Stress and modern life style,Yes,Facilitate the individual to realise his self,No,N/A
None,India,"The exact cause is unknown, but researches suggest that a combination of factors including heredity, psychological trauma etc",Yes,N/A,No,N/A
Jain,India,Mental abuse,Yes,N/A,No,N/A
Jain,India,Stress,Yes,Therapy,No,N/A
Roman Catholic,India,"Bullying, Racism, Stress, Disease",Yes,"By being a better person to the patient, and teaching others the virtue of kindness and love.",No,N/A
Sikhism,India,"Genetics, Traumatic Events, Stressors, etc",Yes,Therapy and medications,No,N/A
Sikhism,India,Overthinking and Anxiety,Yes,Self Motivation and Professional Advice,No,N/A
Agnostic,India,Past experiences,Yes,Mental health experts,No,N/A
Atheist,India,"Trauma, chemicals in the brain etc.",Yes,proper guidance from a professional,No,N/A
Christian,India,"Different causes such as biological, environmental, etc.",Yes,If proper treatment administered early on then it is treatable.,No,N/A
Christian,India,Society fear and acceptance,Yes,N/A,No,N/A
Christian,India,Society pressure and acceptance,Yes,N/A,No,N/A
Christian,India,Stress,Yes,Therapy,No,N/A
Christian,India,Yourself,Yes,N/A,No,N/A
Budhist,India,Problems,Yes,By visiting a Pyschratrist,No,N/A
Hindhu,India,"A number of factors like genetics, family environment, personal resilience level",Yes,With proper interventions and therapy,No,N/A
Hindhu,India,"Carelessness towards Self, Not able to deal effectively with Potential Mental Health Concerns",Yes,Mental Health Conditions can be treated with various interventions and techniques alike normal consultation of physical health,No,N/A
Hindhu,India,Depression,Yes,To talk with someone who can guide them QA,No,N/A
Hindhu,India,"Depression, emotional problems, environmental problems",Yes,Talk therapy,No,N/A
Hindhu,India,"Discrimination, loneliness",Yes,N/A,No,N/A
Hindhu,India,Environmental causes,Yes,"Therapy, counselling and medications.",No,N/A
Hindhu,India,"Genes, environmental influences",Yes,"Through diagnosis and assessments, medications and strategized therapies",No,N/A
Hindhu,India,"Genetic, Environment, Chemical Imbalance",Yes,N/A,No,N/A
Hindhu,India,Genetics & environmental factors,Yes,By consulting mental health professionals,No,N/A
Hindhu,India,"Genetics, environmental factors, social factors",Yes,"With medications, psychotherapy and counselling",No,N/A
Hindhu,India,Hormonal as well as situations,Yes,Proper medication and consultation,No,N/A
Hindhu,India,Lack of Psycho-education,Yes,by professional care,No,N/A
Hindhu,India,Mental health,Yes,Mental problems solution,No,N/A
Hindhu,India,"Multi factorial - lifestyle changes, circumstances, hormonal changes, grief, genetics, etc.",Yes,"Therapy, Drugs, Support",No,N/A
Hindhu,India,"Multiple factors like genetics, environmental influences",Yes,Through accurate diagnosis and assessments through strategized therapies and medications,No,N/A
Hindhu,India,N/A,Yes,N/A,No,N/A
Hindhu,India,N/A,Yes,By getting professional help,No,N/A
Hindhu,India,N/A,Yes,With seeking professional help,No,N/A
Hindhu,India,Not applicable,Yes,N/A,No,N/A
Hindhu,India,Overthinking,Yes,N/A,No,N/A
Hindhu,India,"Overthinking , stress & anxiety",Yes,By helping the individual from the situation.,No,N/A
Hindhu,India,Past experiences/ History,Yes,Therapy and exercises,No,N/A
Hindhu,India,Past trauma,Yes,Therapy,No,N/A
Hindhu,India,Present lifestyle stress anxiety depression,Yes,It can be treat with therapy taken from a therapist,No,N/A
Hindhu,India,Pressure,Yes,Clinical,No,N/A
Hindhu,India,Prolly passing on trauma,Yes,N/A,No,N/A
Hindhu,India,Social pressure,Yes,By talking to a professional or a friend too,No,N/A
Hindhu,India,Society,Yes,By systematic counselling,No,N/A
Hindhu,India,Society,Yes,Having someone to talk with,No,N/A
Hindhu,India,stress,Yes,study the root cause and analyse.,No,N/A
Hindhu,India,Stress,Yes,N/A,No,N/A
Hindhu,India,Stress,Yes,Through careful evaluation and constant care,No,N/A
Hindhu,India,"Stress, any childhood or emotional trauma",Yes,"Therapy , interacting with your close people",No,N/A
Hindhu,India,"Stress, diseases",Yes,N/A,No,N/A
Hindhu,India,"Stress, Past Trauma",Yes,Therapy,No,N/A
Hindhu,India,"Stress, Triggers, trauma (childhood or adulthood)",Yes,"Medication, therapy",No,N/A
Hindhu,India,"Stress,genetics",Yes,"Counselling, medicines",No,N/A
Hindhu,India,"studies, work pressure",Yes,believe,No,N/A
Hindhu,India,Surroundings,Yes,With appropriate care mental health can be treated,No,N/A
Hindhu,India,"There are a lot of causes, physical, mental, social etc. Can not pin point one.",Yes,"They can be treated. Can not make promises about curing them, but treating and managing? yes.",No,N/A
Hindhu,India,"Trauma, abuse, stress.",Yes,Giving some time for the situation to pass and getting proper therapy can help.,No,N/A
Hindhu,India,"Trauma, childhood abuse or neglect and awful experiences in life.",Yes,Through therapy.,No,N/A
Hindhu,India,Unreal expectations,Yes,N/A,No,N/A
Hindhu,India,"Would say there are many, mainly your situation and your beliefs",Yes,"Talking to professionals(psychologist, psychiatrist)",No,N/A
Hindhu,India,Your surroundings and circumstances,Yes,Can be treated with proper medications,No,N/A
Islam,India,"Childhood traumas , social isolation and loneliness,bereavement",Yes,"I think they can be treated as there are many treatments you are able to do which overall in the end can work , some treatments work for others but some don’t do you have to see which one works best for you.",No,N/A
Islam,India,"Environment, genetics, life experiences, negative thinking patterns, unhealthy habits",Yes,By seeking mental health professionals,No,N/A
Islam,India,"Social and personal Environment, maladaptive coping strategies, stress, parenting techniques used on one as a child",Yes,Psychotherapy can help treat mental illnesses.,No,N/A
Islam,India,Stress,Yes,Through professional help,No,N/A
Islam,India,Stress,Yes,Through professional help,No,N/A
Islam,India,"Stress, Family issues",Yes,Having a discussion with close friend or family and meditation,No,N/A
Islam,India,"Stress, Genetics, Lifestyle, Lack of Support, etc",Yes,therapy,No,N/A
Islam,India,"Traumas, Depression, anxiety.",Yes,Therapy could be one of the way,No,N/A
Other,India,"Genetic, Stess, General",Yes,"Medication, Counselling, Therapy, Keeping Mind busy of the Patient by engaging in different activities",No,N/A
None,India,"Can be many things include environment, stress, physical health",Yes,Therapy and medication,No,N/A
Hindhu,India,"Heredity, culture, environment, society",Yes,Yes treatment to control maladaptive symptoms is possible. Both medication and therapy might be needed to help the person cope depending on the nature and severity of the problem,No,N/A
Hindhu,India,It can be biological and environmental influence,Yes,With proper therapy and psychiatric medicines if needed,No,N/A
Hindhu,India,N/A,Yes,N/A,No,N/A
Hindhu,India,Stress,Yes,Therapy,No,N/A
Hindhu,India,Surrounding conditions,Yes,By providing support from friend and family member,No,N/A
Islam,India,"Pressure , stigma",Yes,"Therapy, less stigma",No,N/A
Islam,India,Too much stress,Yes,By sharing things to our friends and family letting them know about the trouble you're going through,No,N/A
Budhist,Sri Lanka,N/A,Yes,"Therapy, Medication",No,N/A
Islam,Sri Lanka,Expectations,Yes,"If the way of thinking of a person can be changed, then mental health can be treated",No,N/A
Islam,Sri Lanka,Financial  or work stress,Yes,Counselling,No,N/A
Islam,Sri Lanka,Stress,Yes,"Having a good relationship, meditation, trying to get a stress-free life",No,N/A
Other,Pakistan,"Domestic issues, Financial dependence, child abuse, harassment, even ongoing disturbed circumstances in Palestine, Sudan and Congo",Yes,"Yes it can be treated by various techniques like psychoeducation, therapies etc.",No,N/A
Other,Pakistan,Environment,Yes,N/A,No,N/A
Christian,Pakistan,Stress,Yes,N/A,No,N/A
Islam,Pakistan,Anxiety,Yes,Yes...through medicines and therapies it is possible,No,N/A
Islam,Pakistan,Any external issues may,Yes,By therapy maybe,No,N/A
Islam,Pakistan,behaviour of society,Yes,if discussed with professionals,No,N/A
Islam,Pakistan,Being away from religion particularly Islam,Yes,"Having Faith on Allah, counselling, acknowledging that I have a  disorder...",No,N/A
Islam,Pakistan,"Childhood abuse , trauma, neglect",Yes,"There are many different treatment options available . individual can chose the treatment or combination of treatment, which works best.",No,N/A
Islam,Pakistan,Constant criticism on a person in his childhood,Yes,N/A,No,N/A
Islam,Pakistan,Current issues like expensiveness,Yes,With medical equipment and remove stress,No,N/A
Islam,Pakistan,Depression,Yes,N/A,No,N/A
Islam,Pakistan,Depression,Yes,N/A,No,N/A
Islam,Pakistan,Depression,Yes,By the treatment from psychiatrist & psychologist,No,N/A
Islam,Pakistan,Depression,Yes,By the treatment from psychiatrist and psychologist,No,N/A
Islam,Pakistan,Depression,Yes,My counseling it with a professional,No,N/A
Islam,Pakistan,Dippression,Yes,Psychotherapist  medication hospitalization.,No,N/A
Islam,Pakistan,Domestic problems,Yes,Through proper consultation and therapy sessions,No,N/A
Islam,Pakistan,Environment,Yes,Bcz of environment,No,N/A
Islam,Pakistan,Environment,Yes,Psychological therapies can be helpful,No,N/A
Islam,Pakistan,Environment in which people live,Yes,With conversation hearing other thoughts,No,N/A
Islam,Pakistan,"Excessive Social media use, toxic relationships",Yes,N/A,No,N/A
Islam,Pakistan,Expectations & Ignorance,Yes,N/A,No,N/A
Islam,Pakistan,Family behaviour or society behaviour,Yes,By ignore them,No,N/A
Islam,Pakistan,Family issues,Yes,N/A,No,N/A
Islam,Pakistan,Family issues and pressure,Yes,By guidance and seeking a psychologist,No,N/A
Islam,Pakistan,Fight between parents,Yes,By offer prayers,No,N/A
Islam,Pakistan,I believe the main cause is our environment and people lives around us.,Yes,I think of course with the help of good behavior,No,N/A
Islam,Pakistan,I guess childhood trauma's is the main caused,Yes,Except shezophrenia the other mental heath issues can be treated through therapy,No,N/A
Islam,Pakistan,I think its biggest cause is lack of communication and understanding,Yes,"Yes it can be treated by the of people around the person, by communicating and discuss the problems",No,N/A
Islam,Pakistan,Lack believe from Allah Almighty,Yes,"It is treated by therapies,medication etc",No,N/A
Islam,Pakistan,Life trauma,Yes,By acknowledging it and trying to work with it so it can't control you,No,N/A
Islam,Pakistan,Many reasons,Yes,Through treatment,No,N/A
Islam,Pakistan,Mental health cause by our environment and also ones mind badly affect by situation and many more tension of every day in pakistan these matters are alot,Yes,Yes treated,No,N/A
Islam,Pakistan,N/A,Yes,N/A,No,N/A
Islam,Pakistan,N/A,Yes,N/A,No,N/A
Islam,Pakistan,N/A,Yes,N/A,No,N/A
Islam,Pakistan,N/A,Yes,N/A,No,N/A
Islam,Pakistan,N/A,Yes,N/A,No,N/A
Islam,Pakistan,N/A,Yes,N/A,No,N/A
Islam,Pakistan,N/A,Yes,Because of psychologist session,No,N/A
Islam,Pakistan,N/A,Yes,If proper check the doctor it is treated,No,N/A
Islam,Pakistan,N/A,Yes,Yes because the stressed person adopt mental health conditions,No,N/A
Islam,Pakistan,Nill,Yes,N/A,No,N/A
Islam,Pakistan,Nope,Yes,Yes it effects on humans to much either its bad or it's good,No,N/A
Islam,Pakistan,"Not a specific cause.But i guess the environment, parents and society around us.",Yes,I think by attention.By giving time to patient. Trying to understand and showing affection to patient.,No,N/A
Islam,Pakistan,Nothing,Yes,By knowing these problem,No,N/A
Islam,Pakistan,Overthinking,Yes,N/A,No,N/A
Islam,Pakistan,Poor sleep,Yes,N/A,No,N/A
Islam,Pakistan,Poverty,Yes,N/A,No,N/A
Islam,Pakistan,Pressure from the society and tough competition among masses,Yes,By providing counselling and rehabilitation,No,N/A
Islam,Pakistan,problems,Yes,N/A,No,N/A
Islam,Pakistan,Repressing initial signals and constantly brushing our little problems under the carpet.,Yes,"It depends on the severity level, if someone gets help at earlier  stages then more chances to become healthier as before.",No,N/A
Islam,Pakistan,"So many things contribute to it. Sometimes childhood traumas are cause behind this. In our daily life we go through so many problems like physical health, job issues, child abuse etc may become the cause of mental illness.",Yes,It can be treated but we can not complete mental health restore because in ur society other people not help to mentally unstable person as much as he need. If we help him in a better way we can take him towards normal life like others,No,N/A
Islam,Pakistan,Social loneliness,Yes,By psychological therapies,No,N/A
Islam,Pakistan,Society behavior,Yes,To be relaxed,No,N/A
Islam,Pakistan,Society issues,Yes,With the help of psychologists,No,N/A
Islam,Pakistan,Society pressure,Yes,By taking proper medication from a therapist and with seeking help from Allah Pak,No,N/A
Islam,Pakistan,Some tramatic condition,Yes,Due to tharapies and medicine,No,N/A
Islam,Pakistan,stress,Yes,N/A,No,N/A
Islam,Pakistan,Stress,Yes,By seeking doctor,No,N/A
Islam,Pakistan,Stress,Yes,Can b treated by therapy nd medication,No,N/A
Islam,Pakistan,Stress,Yes,Family company and proper diagnosis,No,N/A
Islam,Pakistan,Stress,Yes,Gradullay but with care,No,N/A
Islam,Pakistan,Stress,Yes,If ur mental health is on initial try than it can be treated,No,N/A
Islam,Pakistan,Stress,Yes,Rehabilitation,No,N/A
Islam,Pakistan,Stress,Yes,Treated by consullenig,No,N/A
Islam,Pakistan,Stress,Yes,Yes but not for forever,No,N/A
Islam,Pakistan,Stress,Yes,"Yes, by proper medication",No,N/A
Islam,Pakistan,Stress or depression,Yes,By proper counselling,No,N/A
Islam,Pakistan,Tanuting,Yes,Providing the right atmosphere,No,N/A
Islam,Pakistan,Tension,Yes,N/A,No,N/A
Islam,Pakistan,Tension,Yes,N/A,No,N/A
Islam,Pakistan,Tension,Yes,By providing free talk,No,N/A
Islam,Pakistan,"These include biological factors (e.g., brain trauma), psychological factors (e.g., stressful events), and sociocultural factors (e.g., poverty). A family history of mental and addictive disorders also can increase risk.",Yes,"Psychological therapies can be helpful for most people affected by mental health issues. For some mental health conditions, medications can also be helpful. Other support options include counselling, peer support, and community support services.",No,N/A
Islam,Pakistan,Thinking pattern,Yes,Under psychiatric care and due to proper counseling,No,N/A
Islam,Pakistan,To much stress,Yes,By relaxing some one and gave him all the need he want,No,N/A
